{
  "intent_id": "INT-078",
  "title": "MVP deployment: Local Laptop runner (offline bundle)",
  "requirements_in_scope": [
    "REQ-V1-VIDEO-INGEST-001",
    "REQ-V1-VIDEO-RUNNER-001",
    "FUSBAL-V1-OUT-001",
    "GREENFIELD-OPS-001",
    "SYS-ARCH-15"
  ],
  "task_ids_planned": [
    "TASK-LOCAL-CLI-RUNNER-MVP-001",
    "TASK-LOCAL-MODES-MVP-001",
    "TASK-LOCAL-DOCS-MVP-001"
  ],
  "paths_allowed": [
    "spec/",
    "spec/md/docs/",
    "pipeline/",
    "status/audit/"
  ],
  "paths_excluded": [
    "docs/",
    "status/intents/",
    "status/portal/",
    "status/wizard/"
  ],
  "runbooks": {
    "decision": "none",
    "paths_mdt": [],
    "notes": "No runbook changes required for this intent."
  },
  "close_gate": {
    "commands": [
      "npm run generate",
      "npm run guardrails",
      "npm run audit:intent -- --intent-id INT-078"
    ],
    "evidence_out_root": "status/audit/INT-078/runs"
  }
}
