{
  "intent_id": "INT-040",
  "title": "Ball tracking + conservative shots/goals (V1)",
  "requirements_in_scope": [
    "FUSBAL-V1-BALL-001",
    "FUSBAL-V1-EVENT-001",
    "FUSBAL-V1-TRUST-001"
  ],
  "task_ids_planned": [
    "TASK-BALL-DET-001",
    "TASK-BALL-TRACK-001",
    "TASK-EVENT-001",
    "TASK-INT-040-IMP-001",
    "TASK-INT-040-IMP-002",
    "TASK-INT-040-IMP-003",
    "TASK-INT-040-IMP-004",
    "TASK-INT-040-IMP-005",
    "TASK-INT-040-IMP-006",
    "TASK-INT-040-IMP-007",
    "TASK-INT-040-IMP-008",
    "TASK-INT-040-IMP-009",
    "TASK-INT-040-IMP-010"
  ],
  "paths_allowed": [
    "spec/",
    "spec/md/docs/",
    "pipeline/",
    "status/audit/"
  ],
  "paths_excluded": [
    "docs/",
    "status/intents/",
    "status/portal/",
    "status/wizard/"
  ],
  "runbooks": {
    "decision": "none",
    "paths_mdt": [],
    "notes": "No runbook changes required for this intent."
  },
  "close_gate": {
    "commands": [
      "npm run generate",
      "npm run guardrails",
      "npm run audit:intent -- --intent-id INT-040"
    ],
    "evidence_out_root": "status/audit/INT-040/runs"
  }
}
