{
  "intent_id": "INT-050",
  "title": "Video ingest → plumbing proof → baseline real detections (UAT)",
  "requirements_in_scope": [
    "REQ-V1-VIDEO-INGEST-001",
    "REQ-V1-VIDEO-RUNNER-001",
    "REQ-V1-BALL-DETECT-BASELINE-001",
    "FUSBAL-V1-DATA-001",
    "FUSBAL-V1-BALL-001",
    "FUSBAL-V1-EVENT-001",
    "FUSBAL-V1-TRUST-001",
    "SYS-ARCH-15"
  ],
  "task_ids_planned": [
    "TASK-VIDEO-INGEST-001",
    "TASK-RUN-VIDEO-001",
    "TASK-BALL-DET-BASELINE-001",
    "TASK-RUN-VIDEO-STREAM-001",
    "TASK-VIDEO-TOOLS-TIMEOUT-001",
    "TASK-RUN-VIDEO-NULL-ASSERT-001",
    "TASK-DIAGNOSTICS-BALL-DETECTIONS-001",
    "TASK-SHOTS-GOALS-CONFIG-001",
    "TASK-CONTRACT-BALL-FRAMEIDX-001",
    "TASK-VIDEO-TOOLS-NODE-DECOUPLE-001",
    "TASK-BALL-DET-REGRESSION-001",
    "TASK-CLI-EXIT-CODES-001",
    "TASK-PORTAL-AUDIT-RUNS-001"
  ],
  "paths_allowed": [
    "spec/",
    "spec/md/docs/",
    "pipeline/",
    "status/audit/"
  ],
  "paths_excluded": [
    "docs/",
    "status/intents/",
    "status/portal/",
    "status/wizard/"
  ],
  "runbooks": {
    "decision": "none",
    "paths_mdt": [],
    "notes": "No runbook changes required for this intent."
  },
  "close_gate": {
    "commands": [
      "npm run generate",
      "npm run guardrails",
      "npm run audit:intent -- --intent-id INT-050"
    ],
    "evidence_out_root": "status/audit/INT-050/runs"
  }
}
