{
  "intent_id": "INT-060",
  "title": "Useful overlay.mp4 rendering for UAT (ball + confidence)",
  "requirements_in_scope": [
    "FUSBAL-V1-OUT-001",
    "FUSBAL-V1-DATA-001",
    "FUSBAL-V1-BALL-001",
    "FUSBAL-V1-TRUST-001",
    "SYS-ARCH-15"
  ],
  "task_ids_planned": [
    "TASK-OVERLAY-001",
    "TASK-OVERLAY-002",
    "TASK-OVERLAY-TIMEOUT-STDERR-001",
    "TASK-OVERLAY-FPS-PROBE-001",
    "TASK-OVERLAY-ENABLE-N-EXPR-001",
    "TASK-OVERLAY-DEDUP-PER-FRAME-001",
    "TASK-OVERLAY-MAXOPS-TOPK-001",
    "TASK-OVERLAY-FFMPEG-OVERRIDE-VERSION-001",
    "TASK-OVERLAY-BBOX-CLAMP-001",
    "TASK-OVERLAY-RENDER-REPORT-001",
    "TASK-OVERLAY-TRUSTFIRST-MESSAGE-001",
    "TASK-PORTAL-OVERLAY-LINK-001"
  ],
  "paths_allowed": [
    "spec/",
    "spec/md/docs/",
    "pipeline/",
    "status/audit/"
  ],
  "paths_excluded": [
    "docs/",
    "status/intents/",
    "status/portal/",
    "status/wizard/"
  ],
  "runbooks": {
    "decision": "none",
    "paths_mdt": [],
    "notes": "No runbook changes required for this intent."
  },
  "close_gate": {
    "commands": [
      "npm run generate",
      "npm run guardrails",
      "npm run audit:intent -- --intent-id INT-060"
    ],
    "evidence_out_root": "status/audit/INT-060/runs"
  }
}
