{
  "intent_id": "INT-071",
  "title": "MVP-0: player detection + tracking (YOLO + MOT, trust-first)",
  "requirements_in_scope": [
    "FUSBAL-V1-PLAYER-001",
    "FUSBAL-V1-TEAM-001",
    "FUSBAL-V1-DATA-001",
    "FUSBAL-V1-TRUST-001",
    "SYS-ARCH-15"
  ],
  "task_ids_planned": [
    "TASK-PLAYER-DET-YOLO-001",
    "TASK-PLAYER-MOT-MVP-001",
    "TASK-PLAYER-TRACKS-JSONL-MVP-001",
    "TASK-TEAM-BIBS-MVP-001",
    "TASK-PLAYER-E2E-RUNNER-MVP-001"
  ],
  "paths_allowed": [
    "spec/",
    "pipeline/",
    "status/audit/"
  ],
  "paths_excluded": [
    "docs/",
    "models/",
    "status/intents/",
    "status/portal/",
    "status/wizard/"
  ],
  "runbooks": {
    "decision": "none",
    "paths_mdt": [],
    "notes": "No runbook changes required for this intent."
  },
  "close_gate": {
    "commands": [
      "npm run generate",
      "npm run guardrails",
      "npm run audit:intent -- --intent-id INT-071"
    ],
    "evidence_out_root": "status/audit/INT-071/runs"
  }
}
