{
  "intent_id": "INT-073",
  "title": "MVP-2: calibration + BEV (quality-gated) + running stats",
  "requirements_in_scope": [
    "FUSBAL-V1-CAL-001",
    "FUSBAL-V1-BEV-001",
    "FUSBAL-V1-OUT-001",
    "FUSBAL-V1-TRUST-001",
    "SYS-ARCH-15"
  ],
  "task_ids_planned": [
    "TASK-CAL-AUTO-MVP-001",
    "TASK-CAL-MANUAL-CLICK-MVP-001",
    "TASK-BEV-GATE-DIAGNOSTICS-MVP-001",
    "TASK-BEV-RENDER-MVP-001",
    "TASK-STATS-METERS-MVP-001"
  ],
  "paths_allowed": [
    "spec/",
    "pipeline/",
    "status/audit/"
  ],
  "paths_excluded": [
    "docs/",
    "status/intents/",
    "status/portal/",
    "status/wizard/"
  ],
  "runbooks": {
    "decision": "none",
    "paths_mdt": [],
    "notes": "No runbook changes required for this intent."
  },
  "close_gate": {
    "commands": [
      "npm run generate",
      "npm run guardrails",
      "npm run audit:intent -- --intent-id INT-073"
    ],
    "evidence_out_root": "status/audit/INT-073/runs"
  }
}
