{
  "intent_id": "INT-076",
  "title": "MVP: evaluation harness + regression gates",
  "requirements_in_scope": [
    "GREENFIELD-EVIDENCE-001",
    "GREENFIELD-OPS-001",
    "FUSBAL-V1-TRUST-001",
    "SYS-ARCH-15"
  ],
  "task_ids_planned": [
    "TASK-EVAL-DATASET-SPEC-MVP-001",
    "TASK-EVAL-METRICS-MVP-001",
    "TASK-EVAL-GOLDEN-RUNS-MVP-001",
    "TASK-EVAL-REGRESSION-GATES-MVP-001"
  ],
  "paths_allowed": [
    "spec/",
    "scripts/",
    "tools/",
    "pipeline/",
    "status/audit/"
  ],
  "paths_excluded": [
    "docs/",
    "status/intents/",
    "status/portal/",
    "status/wizard/"
  ],
  "runbooks": {
    "decision": "none",
    "paths_mdt": [],
    "notes": "No runbook changes required for this intent."
  },
  "close_gate": {
    "commands": [
      "npm run generate",
      "npm run guardrails",
      "npm run audit:intent -- --intent-id INT-076"
    ],
    "evidence_out_root": "status/audit/INT-076/runs"
  }
}
