{
  "intent_id": "INT-074",
  "title": "MVP-1: learned ball model integration (checkpoint-driven)",
  "requirements_in_scope": [
    "FUSBAL-V1-BALL-001",
    "FUSBAL-V1-DATA-001",
    "FUSBAL-V1-TRUST-001",
    "SYS-ARCH-15"
  ],
  "task_ids_planned": [
    "TASK-BALL-DET-LEARNED-MVP-001",
    "TASK-BALL-TRACK-MVP-001",
    "TASK-BALL-CONTRACT-INTEGRATION-MVP-001"
  ],
  "paths_allowed": [
    "spec/",
    "pipeline/",
    "status/audit/"
  ],
  "paths_excluded": [
    "docs/",
    "status/intents/",
    "status/portal/",
    "status/wizard/"
  ],
  "runbooks": {
    "decision": "none",
    "paths_mdt": [],
    "notes": "No runbook changes required for this intent."
  },
  "close_gate": {
    "commands": [
      "npm run generate",
      "npm run guardrails",
      "npm run audit:intent -- --intent-id INT-074"
    ],
    "evidence_out_root": "status/audit/INT-074/runs"
  }
}
