{
  "intent_id": "INT-010",
  "title": "Define V1 output contract + pipeline scaffolding",
  "requirements_in_scope": [
    "FUSBAL-V1-OUT-001",
    "FUSBAL-V1-DATA-001",
    "FUSBAL-V1-TRUST-001",
    "SYS-ARCH-15",
    "AUD-REQ-10"
  ],
  "task_ids_planned": [
    "TASK-V1-OUT-001",
    "TASK-V1-DATA-001",
    "TASK-V1-CLI-001"
  ],
  "close_gate": {
    "commands": [
      "npm run guardrails",
      "npm run generate:check",
      "npm run audit:intent -- --intent-id INT-010"
    ],
    "evidence_out_root": "status/audit/INT-010/runs"
  }
}
